{"artifact_kind":"SOURCE_SNAPSHOT","canonicalization_profile":"veritrail-json-c14n/1","inventory":[{"content":{"sha256":"1237d6118bb2d732c6573be618bd0f536a32ca741817e85e0d99750050ee7736","size_bytes":15},"entry_kind":"REGULAR_BLOB","git_mode":"100644","git_object":{"algorithm":"SHA1","hex":"cccccccccccccccccccccccccccccccccccccccc","object_type":"BLOB"},"git_path":{"git_path_hex":"706b672f6d6f642e7079","path_kind":"GIT_PATH"}}],"inventory_digest":"43440b91088d35cae426bf0de639b3e14fef36fd707140bd521a9c20376faa11","repository_id":"fixture/repository","schema_version":"0.1","source_content_digest":"67e72fdd0f9b98430aa13db8e9a1c5838841b628d70e7e46c3da1abc023edb78","source_coordinate":{"analysis_root":{"path_kind":"REPOSITORY_ROOT"},"analysis_tree_oid":{"algorithm":"SHA1","hex":"bbbbbbbbbbbbbbbbbbbbbbbbbbbbbbbbbbbbbbbb"},"commit_oid":{"algorithm":"SHA1","hex":"aaaaaaaaaaaaaaaaaaaaaaaaaaaaaaaaaaaaaaaa"},"commit_tree_oid":{"algorithm":"SHA1","hex":"bbbbbbbbbbbbbbbbbbbbbbbbbbbbbbbbbbbbbbbb"}},"source_coordinate_digest":"cd6e1ba988f3948404585de2ea0a9eacdfab6f61daa7e04026949eae2885ae6b","source_snapshot_digest":"3acb02f99805fd684ff68a1e0d2a2e24a22d75232564a1f52646c89e4398f747"}
